{
  "tool_name": "scene_delete_object",
  "category": "scene",
  "mode_required": "OBJECT",
  "selection_required": false,
  "keywords": ["delete", "remove", "destroy", "object"],
  "sample_prompts": ["delete the cube", "remove object from scene", "delete object named Sphere"],
  "parameters": {
    "name": {"type": "string", "required": true, "description": "Name of the object to delete"}
  },
  "related_tools": ["scene_list_objects", "scene_clean_scene"],
  "patterns": [],
  "description": "Deletes an object from the scene by name."
}
