{
  "tool_name": "scene_clean_scene",
  "category": "scene",
  "mode_required": "OBJECT",
  "selection_required": false,
  "keywords": ["clean", "clear", "reset", "fresh", "delete all"],
  "sample_prompts": ["clean the scene", "clear all objects", "reset the scene", "start fresh"],
  "parameters": {
    "keep_lights_and_cameras": {"type": "bool", "default": true, "description": "Keep lights and cameras"}
  },
  "related_tools": ["scene_delete_object", "scene_list_objects"],
  "patterns": [],
  "description": "Clears the scene, optionally keeping lights and cameras."
}
