{
  "tool_name": "modeling_transform_object",
  "category": "modeling",
  "mode_required": "OBJECT",
  "selection_required": false,
  "keywords": [
    "transform",
    "move",
    "rotate",
    "scale",
    "position",
    "object"
  ],
  "sample_prompts": [
    "move the object",
    "rotate object 90 degrees",
    "scale object to double",
    "set object position",
    "transform the cube"
  ],
  "parameters": {
    "name": {
      "type": "string",
      "required": true,
      "description": "Name of the object"
    },
    "location": {
      "type": "vector3",
      "default": null,
      "description": "New position [x, y, z]"
    },
    "rotation": {
      "type": "vector3",
      "default": null,
      "description": "Rotation in radians [x, y, z]"
    },
    "scale": {
      "type": "vector3",
      "default": null,
      "description": "Scale factors [x, y, z]"
    }
  },
  "related_tools": [
    "modeling_create_primitive",
    "scene_set_active_object"
  ],
  "patterns": [],
  "description": "Transforms (move, rotate, scale) an existing object."
}
